Propublica Number,Name
43078945,SPEE CLUB INC
46002810,HARVARD LAMPOON
42631286,HARVARD LAMPOON TRUST UNDER DECLARATION OF TRUST
42645068,HARVARD-RADCLIFFE GILBERT & SULLIVAN PLAYERS
41425590,HASTY PUDDING CLUB THE INSTITUTE OF 1770
42426396,HARVARD CRIMSON INC
222780253,THE HARVARD CRIMSON TRUST II
41696700,OWL CLUB
204744523,OWL CLUB CAPITAL MANAGEMENT INC
43573739,HARVARD KROKODILOES INC
42628384,HARVARD GLEE CLUB INC
460697343,HARVARD MODEL CONGRESS DUBAI
43009105,HARVARD UNIVERSITY BAND INC
42456752,HARVARD INDEPENDENT INC
202775261,HARVARD MODEL CONGRESS INCORPORATED
46042150,HARVARD YEARBOOK PUBLICATIONS INCORPORATED
42597463,HARVARD DEBATE INCORPORATED QUINCY HOUSE 801
42587675,HARVARD-RADCLIFFE COLLEGIUM MUSICUM INC
204741249,HARVARD COLLEGE ASSOCIATION FORUS-CHINA RELATIONS
42230366,HARVARD STUDENT AGENCIES INC
42313930,HARVARD GLEE CLUB FOUNDATION INC
43399927,HARVARD SQUARE HOMELESS SHELTER CORPORATION
42581946,INTERNATONAL RELATIONS COUNCIL INC HARVARD UNIVERSITY
46066702,HARVARD RADIO BROADCASTING CO INC
510201171,HARVARD-RADCLIFFE ORCHESTRA INC PIERIAN SODALITY OF 1808
42444738,HARVARD PIERIAN FOUNDATION INC
461959847,ALPHA PHI INTERNATIONAL FRATERNITY
760795560,FOX CLUB UNDERGRADUATE ASSOCIATION INC
43464134,THE SENECA INC
203522249,BEE CLUB INC
136085147,DELPHIC TRUST
41833930,SIGNET SOCIETY
